{
  "schemaVersion": "guard.extension-listing.v1",
  "extensionId": "command.genclave",
  "tagline": "Reviews destructive mutations, policy changes, and session unlocks for the gEnclave security vault CLI.",
  "category": "specialized-tools",
  "limitations": [
    "Coverage is limited to the reviewed operations and the surrounding Guard policy.",
    "A maintainer profile is not a security certification or an official upstream endorsement."
  ],
  "maintainerGithubIds": [
    "225115"
  ]
}
